Code status (F=full;S=semi),Year,Author,Title,Journal Title,ISBN/ISSN,DOI.URL,Abstract,Volume,Issue,Pages
F,2009,"Toonen, Hilde M.",Adapting to an innovation: Solar cooking in the urban households of Ouagadougou (Burkina Faso),"Physics and Chemistry of the Earth, Parts A/B/C",1474-7065,https://doi.org/10.1016/j.pce.2008.03.006,"Most households in Sub-Saharan Africa rely on wood as primary energy source. The availability of wood is decreasing and deforestation is a major ecological problem in Sub-Saharan Africa. The scarcity of wood is demanding for a sustainable solution. The sun seems to provide a good alternative. Solar energy is free, without unhealthy smoke or chances to burns. The idea of using solar energy for cooking is not new: many different techniques have already been tested. Most variants are expensive, and therefore not available for most families in Sub-Saharan Africa. A cheap solar cooking device is the CooKit, a cardboard panel cooker covered with aluminium foil. In the adaptation to the CooKit, as to all innovations, it is important that the users are convinced of the advantages. An important step in the adaptation process is learning how to use the cooking device; the best way to do this is by home practice. Monitoring and evaluating the real use is needed, for it is interesting to know if the CooKit is actually used, and also to find out how women have implemented the new technique in their kitchens. In 2005, the SUPO foundation started a project in Burkina Faso: Programme Energie Solaire Grand-Ouaga (PESGO). The aim of PESGO is to introduce the CooKit in the urban households in Ouagadougou by providing training sessions and home assistance. In this paper, a mid-term review on this small-scale cooking project is presented. The possibilities and challenges of solar cooking are outlined, taking the urban context of Ouagadougou in account. In PESGO, dependence on weather conditions is found to be one of the challenges: if sunrays are blocked by clouds or dust in the air, the cooking will be slowed down. The CooKit cannot replace firewood entirely, and a complementary element has to be found. SUPO is exploring the use of Jatropha oil as a complement to the CooKit. The Jatropha plant is drought tolerant and its fruits contain oil which can be used as fuel substitute. Further research on its use is interesting, because the combination of the CooKit and Jatropha oil seems to have high potential in the kitchens of West-Africa.",34,1,65-71
F,2008,"Obueh, J.","Results of Project Gaia’s CleanCook Methanol Stove. Pilot Study in Delta State, Nigeria",Project Gaia Nigeria Pilot Study Final Report,,https://www.projectgaia.com/,,,,
F,2009,"Agurto Adrianzen, M.",The role of social capital in the adoption of firewood efficient stoves in the Northern Peruvian Andes.,MPRA Paper No. 27956,,https://mpra.ub.uni-muenchen.de/27956/,,,,
F,,"Hanna, R.; Duflo, E.; Greenstone, M.",Up in Smoke: The Influence of Household Behaviour on the Long-Run Impact of Improved Cooking Stoves,American Economic Journal: Economic Policy,,DOI: 10.1257/pol.20140008,"Laboratory studies suggest that improved cooking stoves can reduce  indoor air pollution, improve health, and decrease greenhouse gas  emissions in developing countries. We provide evidence, from a  large-scale randomized trial in India, on the benefits of a common,  laboratory-validated stove with a four-year follow-up. While smoke  inhalation initially falls, this effect disappears by year two. We find  no changes across health outcomes or greenhouse gas emissions. Households used the stoves irregularly and inappropriately, failed to  maintain them, and usage declined over time. This study underscores  the need to test environmental technologies in real-world settings  where behavior may undermine potential impacts.",8,1,80-114
F,2002,"Shastri, C.; Sangeetha, G.; Ravindranath, N.","Dissemination of efficient ASTRA stove: case study of a successful entrepreneur in Sirsi, India",Energy for Sustainable Development,,10.1016/S0973-0826(08)60316-6,,6,,63-67
F,2008,"Velasco, I.","More sustainable cooking technologies – A case study in  rural kitchens in Michoacan, Mexico","Thesis, Lund University,  Sweden",,0,,,,
F,2015,"Calvo-Gonzalez, O., Cunha, B. and Trezzi, R.",When Winners Feel Like Losers: Evidence from an Energy Subsidy Reform,The World Bank Economic Review,,http://documents.worldbank.org/curated/en/601991468182346903/pdf/WPS7265.pdf,,31,2,329-350
F,2018,"Calzada, J.; Sanz, A.",Universal access to clean cookstoves: Evaluation of a public program in Peru.,Energy policy,0301-4215,https://doi.org/10.1016/j.enpol.2018.03.066,"The use of biofuels for heating and cooking is the main cause of indoor air pollution in developing countries, and one of the main causes of acute respiratory infections. To tackle this problem, in 2012, the Peruvian Government created the FISE program, which subsidizes the replacement of traditional stoves with gas cookstoves. This paper describes the challenges faced during the implementation of the FISE, such as the selection of beneficiaries and the creation of a national network of suppliers for the delivery of liquefied petroleum gas (LPG) cylinders. Using a dataset with information collected from five districts in the department of Ayacucho in 2015, we apply propensity score matching at the household level to evaluate the effects of the program. We show that the FISE favored the adoption of the LPG cookstoves, but that many households still combine their use with traditional cookstoves. We find no evidence that the use of LPG stoves has reduced respiratory problems in the beneficiary households; however, the program has been found to increase the use of LPG stoves for boiling water, which may reduce the exposition of child in beneficiary households to water-related diseases.",118,,559-572
F,2015,"Wang, Y. and Bailis, R.","The revolution from the kitchen: Social processes of the removal of traditional cookstoves in Himachal Pradesh, India.",Energy for Sustainable Development,,10.1016/j.esd.2015.05.001,"Despite decades of effort, widespread adoption and long-term use of improved cookstoves in developing countries remain hard to achieve. Conventional energy transition models emphasize households' socio-economic improvement as the most important driver of energy transition. However, previous work has shown households' continued use of old cookstoves or fuels even when adopting new technologies. Through a case study in India, this paper highlights the socio-political processes of the permanent removal of the traditional chulha cookstove. Newly available liquefied petroleum gas stoves and improved biomass stoves, thought to be substitutes for chulha, lead to different adoption pathways for lower and higher caste households. Lower caste households seem to remove chulha more readily because of sensitivity to chulha's heavy smoke that pollutes their utensils, kitchen, and clothes. We posit that by adopting cleaner stoves and removing traditional ones, the marginalized can disassociate themselves from practices that perpetuate their social stigma.",27,,127-136
F,2018,"Bruce, N.; Anderson de Cuevas, R.; Cooper, J.; Enonchong, B.; Ronzi, S.; Puzzolo, E.; Mbatchou, B.; Pope, D.",The Government-led initiative for LPG scale-up in Cameroon: Programme development and initial evaluation,Energy for Sustainable Development,0973-0826,https://doi.org/10.1016/j.esd.2018.05.010,"In 2016, the government of Cameroon, a central African country heavily reliant on wood fuel for cooking, published a Masterplan for increasing primary use of LPG from 20% to 58% of households by 2035. Developed via a multi-sectoral committee with support from the Global LPG Partnership, the plan envisages a 400 million Euro investment program to 2030, focused on increasing LPG cylinder numbers, key infrastructure, and enhanced regulation. This case study describes the Masterplan process and investment proposals and draws on community studies and stakeholder interviews to identify factors likely to impact on the planned expansion of LPG use.",46,,103-110
F,2018,"Malakar, Y.",Studying household decision-making context and cooking fuel transition in rural India.,Energy for Sustainable Development,,10.1016/j.esd.2017.12.006,"This short communication piece questions whether unaffordability really matters for families to reject improved fuels. It presents the case of an Indian village where nearly every house has successfully introduced a TV, but only one house adopted LPG for cooking. Considering that the former is more expensive than the latter and whilst both are relatively new and energy-related technologies, the paper asks how and why people decided to adopt one extensively but not the other. Methodologically, the study employs a mixed method approach, collecting both quantitative and qualitative data. The findings suggest that the lack of sufficient income has little influence on people to adopt or reject improved fuels. The paper argues that it may not give us a clear picture if we research why people choose or reject one fuel over another. This paper demonstrates that to understand a household's fuel choice decision, it is essential to understand the broader decision-making context within which families operate and make all decisions.",43,,68-74
F,2019,"Boso, À., Oltra, C. and Hofflinger, Á.","Participation in a programme for assisted replacement of wood-burning stoves in Chile: The role of sociodemographic factors, evaluation of air quality and risk perception.",Energy policy,,10.1016/j.enpol.2019.03.038,"Temuco and Padre Las Casas are two of the most polluted cities in southern Chile; around 90% of the particulate matter emissions are produced by wood-burning stoves used for domestic heating and cooking. Surveys were collected from 489 residents to examine differences between applicants and non-applicants to a programme to replace wood-burning stoves with pellet stoves. Results show that participants who applied to the programme are, on average, older than non-applicants, are more likely to have a respiratory impairment, tend to evaluate indoor air quality worse than non-applicants and tend to perceive the health effects of air pollution as more severe. The findings also suggest that motivation to improve air quality is a key aspect for understanding the adoption of pellet stoves when the requirement for initial investment is removed. Practical implications relating to the role of sociodemographic and psychological factors in the decision to replace heating systems are discussed to support the design of more effective interventions to mitigate wood smoke pollution.",129,,1220-1226
F,2019,"Dendup, N.; Arimura, T.H.",Information leverage: The adoption of clean cooking fuel in Bhutan.,Energy Policy,0301-4216,https://doi.org/10.1016/j.enpol.2018.10.054,"The outcome of household choice depends on the private information available to an agent, particularly in terms of costs and bene ts. This study examines the role of information in the adoption of clean cooking fuel in Bhutan. We use a rural subsample of nationally representative data from the 2012 Bhutan Living Standard Survey (BLSS) conducted in all twenty districts. We estimate a bivariate probit model to control for the potentially endogenous information variable. The results indicate that households that have access to information are approximately 39% more likely to adopt clean cooking fuel. Similarly, households are 49% less likely to adopt dirty fuel ( rewood) when exposed to information. Other factors such as education, the electricity supply, access to liquidity and the distance to the market are important factors that contribute to adopting clean cooking fuel. The results also show that the e ect of information varies depending on the level of education of the household heads, thus highlighting the importance of accounting for the level of education of information recipients when designing a similar information provision",125,,181-195
F,2018,"Ma, B.; Yu, Y.; Urban, F.",Green transition of energy systems in rural China: National survey evidence of households’ discrete choices on water heaters.,Energy Policy,,https://doi.org/10.1016/j.enpol.2017.11.046,"Energy systems in rural China are experiencing a transition from traditional fossil fuels to renewables. This paper aims to investigate the potential factors that influence the choices of rural residents regarding water heaters with a focus on the low-carbon transition to solar water heating systems. To this end, a face-to-face questionnaire survey is undertaken with 3404 rural households randomly selected among 12 representative provinces. A comprehensive set of discrete choice modelling approaches were used. The empirical results show that (1) sociodemographic variables have significant effects on residents’ first-stage choice of a water heater (to buy or not to buy) but few effects on the second-stage decision to choose electric, LPG, or solar water heaters (which type to buy); (2) information spillover is important to facilitate the usage of water heaters, particularly of solar products; (3) the electricity price, which is regulated at a very low rate, has no apparent effect on the choice of solar water heaters; (4) government subsidy has a significant effect in the first stage but no differentiated effect on the decision choice in the second stage. Policy and managerial implications are presented to speed up the ongoing low-carbon transition of energy systems in China.",113,,559-579
F,2016,"Kimemia, D.; Annegarn, H.",Domestic LPG interventions in South Africa: Challenges and lessons.,Energy Policy,,https://doi.org/10.1016/j.enpol.2016.03.005,"A majority of grid-connected households in South Africa use electricity for cooking and heating tasks. This thermal intensive use of electricity has a high load factor and is a contributory factor of electricity demand outstripping supply at peak demand periods. The government has promoted liquefied petroleum gas (LPG) as an alternative thermal energy source for household cooking and heating. This study evaluates the long-term successes, challenges and social impacts of an LPG intervention project that was piloted in Atteridgeville Township, a typical low-income suburb. The data was gathered through one-on-one household interviews with a sample of the beneficiaries. The results indicate that seven years after the LPG intervention, about 70% of the beneficiaries continue to use LPG and report that the intervention has improved their welfare. Fast cooking is cited as the key tangible benefit of LPG technology in households, followed by saving on electricity bills. The project would have achieved more success through better community engagement, including strict beneficiary selection criteria; a long-term LPG distribution and maintenance plan; and inclusion of recurring monthly LPG subsidies for indigent households. The study discusses the subset of factors necessary for successful rollouts of similar energy projects.",93,,150-156
F,2018,"Pollard, S.L.; Williams, K.N.; O'Brien, C.J.; Winiker, A.;  Puzzolo, E.; Kephart, J.L.; Fandiño-Del-Rio, M.; Tarazona-Meza, C.; Grigsby, M.R.; Chiang, M.; Checkley, W.",An evaluation of the Fondo de Inclusión Social Energético program to promote access to liquefied petroleum gas in Peru.,Energy for Sustainable Development,,https://doi.org/10.1016/j.esd.2018.06.001,"Introduction - Over 80% of rural households in Peru use solid fuels as their primary source of domestic energy, which contributes to several health problems. In 2016, 6.7 million Peruvians were living in rural areas. The Fondo de Inclusión Social Energético (FISE) LPG Promotion Program, which began in 2012 and is housed under the Ministry of Energy and Mining, is a government-sponsored initiative aimed at reducing use of solid fuels by increasing access to clean fuel for cooking to poor Peruvian households. Methods- We conducted a mixed methods study incorporating data from publicly available records and reports, a community survey of 375 households in Puno (the province with the largest number of FISE beneficiary households), and in-depth interviews with community members and key stakeholders. We used the Reach, Effectiveness – Adoption, Implementation, Maintenance (RE-AIM) framework to guide our data collection and analysis efforts. In a sample of 95 households, we also measured 48-hour area concentrations and personal exposures to fine particulate matter (PM2.5). Results - The FISE LPG promotion program has achieved high geographical reach; the program is currently serving households in 100% of districts in Peru. Households with access to electricity may be participating at a higher level than households without electricity because the program is implemented primarily by electricity distributors. In a sample of 95 households, FISE beneficiaries experienced a reduction in kitchen concentrations of PM2.5; however, there were no differences in personal exposures, and both kitchen and personal exposures were above the WHO intermediate target for indoor air quality. Among the 375 households surveyed, stove stacking with biomass fuels was reported in >95% of both beneficiary and non-beneficiary households, with fewer than 5% reporting exclusive use. In-depth interviews suggest that the complexity of the enrollment process and access to LPG distribution points may be key barriers to participating in FISE. Conclusion - The FISE LPG Program has achieved high reach and its targeted subsidy and surcharge-based financing structure represent a potentially feasible and sustainable model for other government programs. However, the prevalence of stove stacking among FISE beneficiaries remains high. There is a need for improved communication channels between program implementers and beneficiaries. FISE should also consider expanding the mobile LPG network and community delivery service to reduce physical barriers and indirect costs of LPG acquisition. Finally, increasing the value of LPG vouchers to completely cover one or two tanks a month, or alternatively, introducing behavior change strategies to reduce monthly LPG usage, may facilitate the transition to exclusive LPG use.",46,,82-93
F,2019,"Dickinson, K.L.; Piedrahita, R.; Coffey, E.R.; Kanyomse, E.; Alirigia, R.; Molnar, T.; Hagar, Y.; Hannigan, M.P.; Oduro, A.R.; Wiedinmyer, C.",Adoption of improved biomass stoves and stove/fuel stacking in the REACCTING intervention study in Northern Ghana.,Energy Policy,0301-4215,https://doi.org/10.1016/j.enpol.2018.12.007,"In order to support transitions away from open-fire cooking and toward cleaner household energy systems, a better understanding of users’ technology adoption patterns and preferences is needed. This paper highlights key factors influencing use of two types of biomass-burning stoves provided through the REACCTING (Research on Emissions, Air quality, Climate, and Cooking Technology in Northern Ghana) randomized intervention study. We examine traditional and improved stove use over a two year follow up period, finding that the more basic rocket stove was used at a higher rate than the higher-tech gasifier stove. While stove use patterns varied by stove group, region, primary cook occupation, and socioeconomic status, use of traditional stoves remained high across most groups. Users perceived that improved stoves were less suitable for cooking a staple dish, Tuo Zaafi (TZ), and technical problems (e.g., battery failures with the gasifier stove) also limited the effectiveness of the intervention. Moving forward, household energy policies should prioritize a range of technologies that have potential to meet local needs while delivering meaningful health and/or environmental benefits, recognizing that stove and fuel “stacking” is likely to persist. A greater focus on markets and enabling environments is needed to support sustainable and scalable energy transitions.",130,,361-374
F,2017,"Clark, S.; Carter, E.; Shan, M.; Ni, K.; Niu, H.; Tseng, J.T.W.; Pattanayak, S.K.; Jeuland, M.; Schauer, J.J.; Ezzati, M.; Wiedinmyer, C. ","Adoption and use of a semi-gasifier cooking and water heating stove and fuel intervention in the Tibetan Plateau, China.",Environmental Research Letters,,DOI: 10.1088/1748-9326/aa751e,"Improved cookstoves and fuels, such as advanced gasifier stoves, carry the promise of improving health outcomes, preserving local environments, and reducing climate-forcing air pollutants. However, low adoption and use of these stoves in many settings has limited their benefits. We aimed to improve the understanding of improved stove use by describing the patterns and predictors of adoption of a semi-gasifier stove and processed biomass fuel intervention in southwestern China. Of 113 intervention homes interviewed, 79% of homes tried the stove, and the majority of these (92%) continued using it 5–10 months later. One to five months after intervention, the average proportion of days that the semi-gasifier stove was in use was modest (40.4% [95% CI 34.3–46.6]), and further declined over 13 months. Homes that received the stove in the first batch used it more frequently (67.2% [95% CI 42.1?92.3] days in use) than homes that received it in the second batch (29.3% [95% CI 13.8?44.5] days in use), likely because of stove quality and user training. Household stove use was positively associated with reported cooking needs and negatively associated with age of the main cook, household socioeconomic status, and the availability of substitute cleaner-burning stoves. Our results show that even a carefully engineered, multi-purpose semi-gasifier stove and fuel intervention contributed modestly to overall household energy use in rural China.",12,7,p. 075004
F,2018,"Hyman J, Bailis R",Assessment of the Cambodian National Biodigester Program,Energy for Sustainable Development,ISSN 0973-0826,https://doi.org/10.1016/j.esd.2018.06.008.,"The National Biodigester Program (NBP) was established in 2006 to build and maintain household biodigesters in Cambodia. In its first six years, the program installed almost 20,000 biodigesters and established an in-country network of local financiers, construction companies, skilled masons, bioslurry specialists and after-care technicians accessible to rural users in 14 of 24 Cambodian provinces. Since its initial success, the program's adoption rates have stalled despite increasing government support and high rates of user satisfaction. Building on an initial evaluation of the NBP in 2013, this updated assessment identifies multiple changes in its second implementation phase that have undermined the initial momentum of the program. Abrupt interruptions in institutional support, deteriorating supply side services (access to construction agents, masons, repair services) and reduced access to credit for farmers have eroded the service network that the first implementation phase established. Structural changes in the rural economy may also contribute to declining demand. Government support to another biodigester program which offers a lower investment price, but does not provide after-sales services, has also undercut the long-term implementation strategy of the NBP. The paper finds that despite these programmatic changes, the installed biodigesters continue to perform according to expectation and to be maintained and valued by their users, but the future viability of the program remains uncertain.",46,,11-22
F,2013,"Pachauri S,  van Ruijven BJ, Nagai Y,  Riahi K, van Vuuren DP,  Brew-Hammond A, Nakicenovic N",Pathways to achieve universal household access to modern energy by 2030,Environmental Research Letters,,doi:10.1088/1748-9326/8/2/024015,"A lack of access to modern energy impacts health and welfare and impedes development for billions of people. Growing concern about these impacts has mobilized the international community to set new targets for universal modern energy access. However, analyses exploring pathways to achieve these targets and quantifying the potential costs and benefits are limited. Here, we use two modelling frameworks to analyse investments and consequences of achieving total rural electrification and universal access to clean-combusting cooking fuels and stoves by 2030. Our analysis indicates that these targets can be achieved with additional investment of US$200565–86 billion per year until 2030 combined with dedicated policies. Only a combination of policies that lowers costs for modern cooking fuels and stoves, along with more rapid electrification, can enable the realization of these goals. Our results demonstrate the critical importance of accounting for varying demands and affordability across heterogeneous household groups in both analysis and policy setting. While the investments required are significant, improved access to modern cooking fuels alone can avert between 0.6 and 1.8 million premature deaths annually in 2030 and enhance wellbeing substantially",8,0,7 pp
