Code status (F=full;S=semi),Year,Author,Title,Journal Title,ISBN/ISSN,DOI.URL,Abstract,Volume,Issue,Pages
S,2019,"Wang, Z.; Li, C.; Cui, C.; Liu, H.; Cai, B. F.",Cleaner heating choices in northern rural China: Household factors and the dual substitution policy,Journal of Environmental Management,0301-4797,10.1016/j.jenvman.2019.109433,"Household heating is a major contributor to frequent winter haze in northern China. Transition to cleaner household heating is associated with multiple benefits including improved environmental conditions and health of local residents. This study presents an analysis of data from an indoor survey covering 1030 households in 136 villages of Hebi City in the winter of 2018. The main purpose of this study was to reveal the key factors that affect cleaner heating choices under the national pilot program of the dual substitution policy, which targets the replacement of coal heating with gas and electric heating. The survey showed that electric heating is the most popular heating method, and the adoption of cleaner heating rises with income, and energy and device costs may be the major barriers to adopting cleaner heating. Further, multinomial logit regression was used to investigate the household factors and found that income, heating area, energy cost, and education had significant impacts on heating choices. In addition, the gas substitution policy was more effective in promoting the cleaner heating transition than was the electric substitution policy. Results show that more freedom to choose energies and devices, as well as infrastructure for gas supply and centralized heating, is also vital for the adoption of cleaner heating. Our study provides new insights to improve the details of implementation of the dual substitution policy.",249,,
S,2015,"Vietor, B.; Hoppe, T.; Clancy, J.",Decentralised combined heat and power in the German Ruhr Valley; assessment of factors blocking uptake and integration,Energy Sustainability and Society,2192-0567,10.1186/s13705-015-0033-0,"Background: In Germany, the energy system is undergoing reorganisation from a centralised system based on fossil fuels and nuclear power to a sustainable system based on decentralised production and consumption of energy, the so-called Energiewende. Recently, there has been more attention to improving energy efficiency in those regions where conventional energy production activities and energy-intensive industries are located, such as the Ruhr area. Although the potential for decentralised combined heat and power (CHP) units is high in this region, local action plans show only modest developments for this technology. In this paper, we address this issue by answering the following research question: Which factors block the uptake and integration of decentralised CHP in the German Ruhr area's energy system? Methods: The multilevel perspective (MLP) was used to analyse the state of system innovation in relation to the uptake and integration of decentralised CHP technology. Prior to the MLP analysis, a stakeholders' analysis was conducted to identify stakeholders' views, positions and experienced barriers regarding the uptake and integration of decentralised CHP technology. Data collection included review of text documents and conducting 11 interviews. Results: Due to many regime barriers blocking niche development, the uptake of decentralised CHP technology is limited. Identified barriers relate to lack of market services and mismatches with user preferences, (sectoral) policies and industrial interests. Conclusions: Observed barriers relate to (i) lack of market services such as financial means for making investments; (ii) user awareness such as unawareness and information deficit regarding the benefits of decentralised CHP to potential users, (iii) the presence of centralised district heating systems, (iv) policy issues such as lack of sufficient policies supporting diffusion of decentralised CHP units, legal stipulations from social housing policies that prevent housing cooperatives from becoming energy producers and district heating systems owned by public and private owners (via concessions contracts); (v) sector issues such as lack of skilled service-providing companies; and (vi) industrial interested such as the vested interests of the coal and gas industry. Moreover, many of the mentioned barriers seem interrelated, especially those concerning policy and finance available for making upfront investments.",5,1,
S,2017,"Troncoso, K.; Soares da Silva, A.",LPG fuel subsidies in Latin America and the use of solid fuels to cook,Energy Policy,0301-4215,https://doi.org/10.1016/j.enpol.2017.04.046,"The use of solid fuels (USF) for cooking is a key environmental health risk factor, affecting more than 2.8 billion people globally. The Sustainable /Development Goal seven (SDG7) aspires to ensure access to affordable, reliable, sustainable and modern energy for all by 2030. This will require transition toward modern cooking fuels such as Liquefied Petroleum Gas (LPG) and electricity. In Latin American and the Caribbean (LAC), 90 million people still rely on solid fuels for cooking. Access and price have been identified as the main factors that limit substitution of solid fuels by clean fuels. In this paper, we present an exploratory analysis of the effects of subsidy policies for LPG in reducing USF in LAC countries when controlling for indicators of socioeconomic development and urbanization. In LAC, subsidies to LPG have substantially contributed to accelerate the transition from USF to clean fuels for cooking. Targeted subsidies should be considered as a policy option to implement the SDG7 on clean energy. Making clean energy accessible to all has the co-benefits of preventing diseases and premature deaths. Understanding the transition processes from USF to cleaner fuels made by LAC countries can better inform policy making in other regions.",107,,188-196
S,2019,"Troncoso, K.; Segurado, P.; Aguilar, M.; Soares da Silva, A.","Adoption of LPG for cooking in two rural communities of Chiapas, Mexico",Energy Policy,0301-4215,https://doi.org/10.1016/j.enpol.2019.110925,"In 2011, a government initiative provided Liquefied Petroleum Gas (LPG) stoves and cylinders to almost 1000 rural families in Chiapas, Mexico. In 2017, the Pan-American Health Organization (PAHO) conducted an evaluation of cooking practices among the beneficiaries of these stoves. Although almost 100% of households continue to use firewood for cooking, they cook an average of 58% of their food with LPG. Of the families that used to rely exclusively on firewood before 2011, 32% have now started to use LPG. Primary cooks ‚Äîalmost entirely women‚Äî recognize the advantages of cooking with LPG and the health Problems associated with firewood use, with the primary barrier to using LPG being its high cost. Women spend 35‚Äì65‚ÄØh a month preparing tortillas ‚Äîthe main food cooked with firewood. The alternative store-bought tortillas are up to three times costlier. When given the opportunity to cook with LPG, families recognize its advantages and are incentivized to continue using it, despite its cost. The higher the socioeconomic status, the higher LPG use is. The authors suggest that subsidizing tortilla production could facilitate the exclusive use of LPG, avoiding the negative health impacts of firewood use and saving more than 25% of women's productive time.",133,,110925
S,2013,"Sriwannawit, P.; Laestadius, S.",Diffusion of photovoltaic systems for rural electrification in Thailand,International Journal of Energy and Environment,2076-2895,http://www.ijee.ieefoundation.org/vol4/issue1/IJEE_04_v4n1.pdf,"This paper studies a pilot project in which photovoltaic systems were installed in thirty-six places in the remote areas of Thailand with no access to electricity. One sub-project out of thirty-six was chosen for in-depth investigation. We discuss the appropriateness of solar energy for Thailand context. The diffusion process of PV systems is analyzed on four elements: innovation, communication channel, time and social system. This project is an extreme case as the PV systems and services were provided for free of charge. Even so, there are still some challenges to get acceptance for this sustainable form of energy.",4,1,49-58
S,2005,"Soma, D.",Dissemination of solar home systems in Vietnam: a case study of successful partnership,Boiling Point,0263-3167,0,"This paper describes the two phases of a programme in Vietnam where solar home systems were disseminated to rural communities: Phase I was implemented between 1995 and 1998, while Phase II was started in 1998. The programme demonstrates how photovoltaic systems can contribute to sustainable development in remote rural communities.",0,50,24-25
S,2009,"Silva, D.; Nakata, T.",Multi-objective assessment of rural electrification in remote areas with poverty considerations,Energy Policy,0301-4215,https://doi.org/10.1016/j.enpol.2009.03.060,"Rural electrification with renewable energy technologies (RETs) offers several benefits to remote areas where diesel generation is unsuitable due to fuel supply constraints. Such benefits include environmental and social aspects, which are linked to energy access and poverty reduction in less-favored areas of developing countries. In this case, multi-objective methods are suitable tools for planning in rural areas. In this study, assessment of rural electrification with renewable energy systems is conducted by means of goal programming towards fuel substitution. The approach showed that, in the Non-Interconnected Zones of Colombia, substitution of traditional biomass with an electrification scheme using renewable energy sources provides significant environmental benefits, measured as land use and avoided emissions, as well as higher employment generation rates than diesel generation schemes. Nevertheless, fuel substitution is constrained by the elevated cost of electricity compared to traditional biomass, which raises households' energy expenditures between twofold to five times higher values. The present approach, yet wide in scope, is still limited for quantifying the impact of energy access improvements on poverty reduction, as well as for the assessment of energy system's technical feasibility.",37,8,3096-3108
S,2007,"Owens, G. M.",Analyzing impacts of bioenergy expansion in China using strategic environmental assessment,Management of Environmental Quality,1477-7835,http://dx.doi.org/10.1108/14777830710753802,"The methodologies and activities taken to assess the environmental impacts of a $33 million pilot project were examined. The Asian Develoment Bank biogas utilization project has supported construction of over 7500 biogas digesters in more than 140 rural villages. Additional 10 000 biogas digesters are programmed as well as significant investments in biogas production through large-scale animal agribusinesses. The latter will be supported through investments utilizing the Clean Development Mechanism. This paper looks at the project's Initial Environmental Examination undertaken at appraisal, assesses the ongoing energy and environmental monitoring plan currently under way, and examines the potential for the use of Strategic Environmental Assessment (SEA) for integrating environmental policy considerations on a regional or provincial level in China. Improved technologies for application of renewable energy - in particular successful application and adoption of biogas digesters at the village level - offer the potential to promote sustainable, cost-effective growth in agriculture with concurrent positive environmental impacts. Based on the relative success of ongoing efforts to promote the adoption of biomass technology, a significant expansion of the bioenergy programme is under consideration by the Ministry of Agriculture. The case study suggests that there is potential for use of SEA as a tool for the establishment of regional or provincial environmental priorities by taking account of information on the economic, social and environmental benefits, and costs and risks of adopting a national strategy for biomass utilization..",18,4,396-412
S,2010,"Opryszko, M. C.; Majeed, S. W.; Hansen, P. M.; Myers, J. A.; Baba, D.; Thompson, R. E.; Burnham, G.",Water and hygiene interventions to reduce diarrhoea in rural Afghanistan: A randomized controlled study,Journal of Water and Health,14778920 (ISSN),10.2166/wh.2010.121,"A randomized controlled trial of four interventions was conducted using tubewells (n = 2,486), liquid sodium hypochlorite ('Clorin') distributed with an improved water vessel (n = 2,305), hygiene promotion (n = 1,877), and a combination of the three (n = 2,040) to create an evidencebase for water policy in Afghanistan. A fifth group served as a control (n = 2,377). Interventions were randomized across 32 villages in Wardak province. Outcomes were measured through two household surveys separated by one year and twice-weekly household surveillance conducted over 16 months. The households receiving all three interventions showed reduction in diarrhoea compared with the control group, through both longitudinal surveillance data (IRR [95% CI] = 0.61 [0.47-0.81]) and cross-sectional survey data (AOR [95% CI] = 0.53 [0.30-0.93]). This reduction was significant when all household members were included, but did not reach significance when only children under five were considered. These results suggest multi-barrier methods are necessary where there are many opportunities for water contamination. Surveillance data suggested a greater impact of interventions on reducing diarrhoeal diseases than data from the surveys. Higher economic status as measured through household assets was associated with lower rates of diarrhoea and greater intervention uptake, excepting Clorin. Use of soap was also associated with lower prevalence of diarrhoea. ¬© IWA Publishing 2010.",8,4,687-702
S,2015,"Nordensvard, J.; Urban, F.",The stuttering energy transition in Germany: Wind energy policy and feed-in tariff lock-in,Energy Policy,0301-4215,10.1016/j.enpol.2015.03.009,"This article aims to examine whether the formulation of specific low carbon policy such as the feed-in tariff for wind energy in Germany can partly be a barrier to a comprehensive energy transition (Energiewende). Despite their short and medium-term success, these policies could create a long-term lock-in if they are formulated in a way that leads to a stagnation of systems innovation. The research finds that while the share of wind energy has increased rapidly over time, the feed-in-tariff and other low carbon policies and incentives have not been sufficient to achieve a socio-technical regime transition in Germany yet. We suggest that the German feed-in-tariff has incorporated wind energy (a niche-innovation) and wind energy actors (pathway newcomers) into a slightly modified socio-technical regime that is rather similar to the earlier 'fossil fuel dominant' socio-technical regime. (c) 2015 Elsevier Ltd. All rights reserved.",82,,156-165
S,2015,"Nayak, Bibhu P.; Werthmann, Christine; Aggarwal, Veena",Trust and cooperation among urban poor for transition to cleaner and modern cooking fuel,Environmental Innovation and Societal Transitions,2210-4224,https://doi.org/10.1016/j.eist.2014.09.002,"A significant percentage of households in India still use firewood, kerosene and other biomass as cooking fuel. A survey on household energy consumption patterns in Hyderabad revealed that monthly expenditure of urban poor on firewood or kerosene is as much as the price of liquefied petroleum gas (LPG) cylinder. However, poorer households do not switch to LPG due to the high initial investments for an LPG connection. A pilot project was initiated to explore the viability of a community-based cooperative solution in pooling financial resources to meet these upfront investment costs and enable slum households to shift from kerosene and firewood to LPG. Two self-help groups were formed comprising 30 households each. The project enabled all 60 member households to obtain an LPG connection. This paper reiterates, through this pilot, that it is possible for communities themselves to come up with innovative and sustainable solutions for achieving common development goals.",14,,116-127
S,2017,"Narula, S. A.; Subhes, Bhattacharyya",Off-grid electricity interventions for cleaner livelihoods: a case study of value chain development in Dhenkanal district of Odisha,Special Issue: Cleaner production towards a sustainable transition.,0959-6526,http://dx.doi.org/10.1016/j.jclepro.2016.07.176,"Lack of access to electricity in rural areas hinders productive activities, which in turn affects sustainable rural development. Off-grid electrification options can offer an alternative but in order to develop productive uses of electricity in off-grid area, a detailed study of livelihoods and potential areas for improvement in the value chain is required. This paper reports such a study where a livelihood baseline survey was undertaken in a cluster of five remote off-grid villages in Dhenkanal district of Odisha (India) and through a series of interviews, focused group meetings and stakeholder interactions, the study finds that value-added services can be developed through an off-grid electrification intervention. Electrification can support productive activities, thereby offering an opportunity for improved income generation and a better quality of life and a transition to cleaner energy sources. The study provides a novel value chain framework for linking off-grid projects with local livelihoods replicable across multiple geographies ensuring sustainability of these projects.",142,Part 1,191-202
S,2015,"Lewis, J. J.; Bhojvaid, V.; Brooks, N.; Das, I.; Jeuland, M. A.; Patange, O.; Pattanayak, S. K.",Piloting Improved Cookstoves in India,Journal of Health Communication,1081-0730,10.1080/10810730.2014.994243,"Despite the potential of improved cookstoves to reduce the adverse environmental and health impacts of solid fuel use, their adoption and use remains low. Social marketing-with its focus on the marketing mix of promotion, product, price, and place-offers a useful way to understand household behaviors and design campaigns to change biomass fuel use. We report on a series of pilots across 3 Indian states that use different combinations of the marketing mix. We find sales varying from 0% to 60%. Behavior change promotion that combined door-to-door personalized demonstrations with information pamphlets was effective. When given a choice amongst products, households strongly preferred an electric stove over improved biomass-burning options. Among different stove attributes, reduced cooking time was considered most valuable by those adopting a new stove. Households clearly identified price as a significant barrier to adoption, while provision of discounts (e.g., rebates given if households used the stove) or payments in installments were related to higher purchase. Place-based factors such as remoteness and nongovernmental organization operations significantly affected the ability to supply and convince households to buy and use improved cookstoves. Collectively, these pilots point to the importance of continued and extensive testing of messages, pricing models, and different stove types before scale-up. Thus, we caution that a one-size-fits-all approach will not boost improved cookstove adoption.",20,,28-42
S,2007,"Habtetsion, Semereab; Tsighe, Zemenfes",Energy sector reform in Eritrea: initiatives and implications,Journal of Cleaner Production,0959-6526,https://doi.org/10.1016/j.jclepro.2005.09.003,"The Government of Eritrea gave priority status to the energy sector immediately after the country's independence in May 1991, as manifested by the rapid improvement in electricity and oil supplies. Electricity generation capacity has increased from a total of 30MW in 1991 to over 130MW at present. The lengths of transmission and distribution lines have similarly increased from 150km to 400km and from 800 to 1300km respectively. However, as in most Sub-Saharan Africa, this public utility is characterised by inefficient managerial, technical and financial performances, an inability to mobilize the funds needed for expansion, low repair and maintenance capacity, inappropriate tariff rates, and inadequate revenue collection mechanisms. This has led the government to take appropriate reform measures in recent years, including the restructuring of the Eritrea Electric Corporation (EEC) to operate on commercial principles, setting tariffs based on real costs and reasonable profits, effective collection of revenues, the minimization of wastage and loss in the delivery of energy services, facilitating the private sector participation, and ring-fencing the interests of the poor by setting up a Rural Electrification Fund. A Regulatory body has been established to enforce these reform measures. Recognising the role of modern energy in poverty reduction and achieving the Millennium Development Goals (MDGs), the Government with the support of its development partners is expanding energy services to rural areas in an innovative manner. The Government's commitment to diversify energy sources is exemplified by its agreement with the Global Environment Facility (GEF) to share the costs of an on-going pilot wind energy project. It has also established an Energy Research and Training Centre to promote the application of renewable energies and improved biomass stoves throughout Eritrea.",15,2,178-189
S,2018,"Evans, W. D.; Johnson, M.; Jagoe, K.; Charron, D.; Young, B. N.; Mashiur Rahman, A. S. M.; Omolloh, D.; Ipe, J.",Evaluation of behavior change communication campaigns to promote modern cookstove purchase and use in lower middle income countries,International Journal of Environmental Research and Public Health,16617827 (ISSN),10.3390/ijerph15010011,"Nearly three billion people worldwide burn solid fuels and kerosene in open fires and inefficient stoves to cook, light, and heat their homes. Cleaner-burning stoves reduce emissions and can have positive health, climate, and women's empowerment benefits. This article reports on the protocol and baseline data from the evaluation of four behavior change communication (BCC) campaigns carried out in lower to middle income countries aimed at promoting the sale and use of cleaner-burning stoves. Interventions implemented in Bangladesh, Kenya, and Nigeria are using a range of BCC methods including mass media, digital media, outdoor advertising, and inter-personal communication. The mixed methods evaluation comprises three large-scale surveys: one pre-BCC and two follow-ups, along with smaller scale assessments of stove uptake and patterns of use. Baseline results revealed varying levels of awareness of previous promotions and positive attitudes and beliefs about modern (i.e., relatively clean-burning) cookstoves. Differences in cookstove preferences and behaviors by gender, socio-demographics, media use, and country/region were observed that may affect outcomes. Across all three countries, cost (lack of funds) a key perceived barrier to buying a cleaner-burning stove. Future multivariate analyses will examine potential dose-response effects of BCC on cookstove uptake and patterns of use. BCC campaigns have the potential to promote modern cookstoves at scale. More research on campaign effectiveness is needed, and on how to optimize messages and channels. This evaluation builds on a limited evidence base in the field. ¬© 2017 by the authors. Licensee MDPI, Basel, Switzerland.",15,1,
S,2018,"Aklin, M.; Cheng, ChaoYo; Urpelainen, J.",Social acceptance of new energy technology in developing countries: a framing experiment in rural India,Energy Policy,0301-4215,http://dx.doi.org/10.1016/j.enpol.2017.10.059,"While the literature on the social acceptance of new technologies focuses on industrialized societies, concerns about new technologies are often deeper and more widespread in developing countries. In a survey experiment with 3208 villagers from six major states of northern India, we examine the social acceptance of off-grid solar power as an alternative to grid extension. By randomly assigning different frames about this energy technology to the villagers, we study how concerns about the cost of sustainable energy, inequality of energy access, and the role of private business and the state shape individuals' acceptance of off-grid solar power. We find that concerns about the role of private business and possible increases in rural-urban inequality are salient among the rural population. The rural population is concerned about (i) exploitative businesses practices and (ii) the inequality that solar power in villages is more expensive than conventional grid power in urban areas. These findings show that the social acceptance of new, sustainable energy technologies cannot be taken for granted in rural development and offer insights into the salience of different varieties of concerns.",113,,466-477
